{
  "$schema": "https://json-schema.org/draft/2020-12/schema",
  "$id": "urn:lvrtc:contract:v1:policy",
  "title": "Policy",
  "description": "How the results of each rung are judged: the quantity compared, the mode of comparison, whether the rung is gated or recorded, the limit of each metric, whether a failure of the rung blocks the later ones, and whose numerical floor may exceed a tolerance. A gated metric needs a tolerance, an independent-method rung is never gated, only a gated rung blocks later ones or has a floor, and floor limits enclose their tolerance; code checks them.",
  "type": "object",
  "properties": {
    "contract": { "$ref": "urn:lvrtc:contract:v1:common#/$defs/contractVersion" },
    "kind": { "const": "policy" },
    "version": {
      "description": "The version of the policy: an integer from 1 that rises whenever a rung, a class or a limit changes.",
      "type": "integer",
      "minimum": 1
    },
    "rungs": {
      "description": "A map from rung id to how the rung is judged.",
      "type": "object",
      "additionalProperties": { "$ref": "#/$defs/rung" }
    }
  },
  "required": ["contract", "kind", "version", "rungs"],
  "additionalProperties": false,
  "$defs": {
    "rung": {
      "type": "object",
      "properties": {
        "quantity": { "$ref": "urn:lvrtc:contract:v1:common#/$defs/quantityId" },
        "mode": { "enum": ["direct", "identical-rays", "independent-method"] },
        "class": { "enum": ["gated", "recorded"] },
        "metrics": {
          "description": "A map from metric name to its limits and unit.",
          "type": "object",
          "additionalProperties": { "$ref": "#/$defs/metric" }
        },
        "blocksLaterRungs": {
          "description": "True: two engines whose pair in this rung is FAIL or ERROR are not judged against each other in any later rung for the same case.",
          "type": "boolean"
        },
        "floor": {
          "description": "The engine whose numerical floor may exceed a tolerance of this rung without failing, and the engine that decides whether an excess is that floor.",
          "type": "object",
          "properties": {
            "engine": { "$ref": "urn:lvrtc:contract:v1:common#/$defs/engineId" },
            "arbiter": { "$ref": "urn:lvrtc:contract:v1:common#/$defs/engineId" }
          },
          "required": ["engine", "arbiter"],
          "additionalProperties": false
        }
      },
      "required": ["quantity", "mode", "class", "metrics"],
      "additionalProperties": false
    },
    "metric": {
      "type": "object",
      "properties": {
        "tolerance": {
          "description": "The largest value a gated metric may have and pass.",
          "$ref": "urn:lvrtc:contract:v1:common#/$defs/nonNegative"
        },
        "attention": {
          "description": "The largest value a recorded metric may have without being marked for attention.",
          "$ref": "urn:lvrtc:contract:v1:common#/$defs/nonNegative"
        },
        "attentionSeveralLines": {
          "description": "Alternate attention limit when either answer records several spectral lines. Requires a recorded metric with attention as its one-line limit.",
          "$ref": "urn:lvrtc:contract:v1:common#/$defs/nonNegative"
        },
        "unit": { "$ref": "urn:lvrtc:contract:v1:common#/$defs/text" },
        "floor": {
          "description": "The floor limits of the metric: the largest value between the rung's floored engine and its arbiter, and the largest between any other engine (a witness) and the arbiter for the witness to corroborate the arbiter. A witness beyond its agreement withholds no floor unless it is nearer to the floored engine than to the arbiter.",
          "type": "object",
          "properties": {
            "limit": { "$ref": "urn:lvrtc:contract:v1:common#/$defs/nonNegative" },
            "agreement": { "$ref": "urn:lvrtc:contract:v1:common#/$defs/nonNegative" }
          },
          "required": ["limit", "agreement"],
          "additionalProperties": false
        }
      },
      "required": ["unit"],
      "additionalProperties": false
    }
  }
}
