{
  "contract": "1.3",
  "kind": "policy",
  "version": 7,
  "rungs": {
    "r5": {
      "quantity": "mtf.native",
      "mode": "independent-method",
      "class": "recorded",
      "metrics": {
        "mtf.maxAbs": {
          "attention": 0.005,
          "attentionSeveralLines": 0.01,
          "unit": "1"
        }
      }
    }
  }
}
